{
  "skill": "model-dispatcher",
  "date": "2026-05-24",
  "task_summary": "Implement XSS protection in Admin Panel logistics and resolve database N+1 queries in the stock-alert Edge Function.",
  "complexity": "low",
  "recommended_model": "Gemini 3.1 Pro (Low)",
  "blast_radius": 2,
  "reasoning": "The task involves simple logic changes in two separate files: an Admin Page component and an Edge Function, which requires solid TypeScript syntax and API compatibility but has low architectural impact.",
  "alternatives": [
    {
      "model": "Gemini 3.1 Pro (High)",
      "score": 90,
      "reason": "Very strong reasoning capability, but slightly overkill since we do not have complex relational logic."
    },
    {
      "model": "Gemini 3 Flash",
      "score": 60,
      "reason": "Capable of simple modifications, but might miss subtle TypeScript compilation or validation details."
    }
  ]
}